{
  "id": "least-racist-person",
  "text": "I am the least racist person you have ever interviewed.",
  "spokenOn": "2018-01-14",
  "context": "Press availability, Palm Beach, Florida",
  "tags": [
    "race",
    "press"
  ],
  "confidence": "widely-reported",
  "sources": [
    {
      "label": "Wikipedia — Donald Trump",
      "url": "https://en.wikipedia.org/wiki/Donald_Trump",
      "type": "reference",
      "accessedAt": "2026-09-13",
      "excerpt": null
    }
  ],
  "speaker": "Donald Trump",
  "notes": null,
  "status": "published",
  "addedAt": "2026-09-13",
  "addedBy": "migration:quotes_on_dev (2018 WordPress demo)"
}
