{
  "id": "fifth-avenue",
  "text": "I could stand in the middle of Fifth Avenue and shoot somebody and I wouldn't lose voters.",
  "spokenOn": "2016-01-23",
  "context": "Campaign rally, Sioux Center, Iowa",
  "tags": [
    "campaign",
    "voters"
  ],
  "confidence": "secondary",
  "sources": [
    {
      "label": "Wikipedia — Donald Trump",
      "url": "https://en.wikipedia.org/wiki/Donald_Trump",
      "type": "reference",
      "accessedAt": "2026-09-13",
      "excerpt": null
    }
  ],
  "speaker": "Donald Trump",
  "notes": null,
  "status": "published",
  "addedAt": "2026-09-13",
  "addedBy": "migration:quotes_on_dev (2018 WordPress demo)"
}
