{
  "id": "big-league",
  "text": "Big league.",
  "spokenOn": null,
  "context": "Rally staple, frequently misheard as “bigly”",
  "tags": [
    "campaign",
    "catchphrase"
  ],
  "confidence": "widely-reported",
  "sources": [
    {
      "label": "Wikipedia — Bigly",
      "url": "https://en.wikipedia.org/wiki/Bigly",
      "type": "reference",
      "accessedAt": "2026-09-13",
      "excerpt": null
    }
  ],
  "speaker": "Donald Trump",
  "notes": null,
  "status": "published",
  "addedAt": "2026-09-13",
  "addedBy": "migration:quotes_on_dev (2018 WordPress demo)"
}
